record_id,name,entity_type,subtype,city,state,country,website,instagram_handle,contact_email,phone,notes,priority,verification_level,source_url,source_type,recommended_outreach_angle,repo_cluster,dedupe_key
997f447088c1,Noopura Institute Of Indian Classical Dance,music_school,music / performing arts class,Thiruvananthapuram,Kerala,India,,,,,"Thiruvananthapuram music/arts education lead; directory-sourced row, verify contact before outreach.",Medium,Medium,https://www.justdial.com/Thiruvananthapuram/Music-Classes/nct-10332940,Directory / public search result,Local outreach lead; verify directly before email/WhatsApp,Thiruvananthapuram,noopura-institute-of-indian-classical-dance|thiruvananthapuram|india|
e799f9bf9af6,Raagatheertham,music_school,music / performing arts class,Thiruvananthapuram,Kerala,India,,,,,"Thiruvananthapuram music/arts education lead; directory-sourced row, verify contact before outreach.",Medium,Medium,https://www.justdial.com/Thiruvananthapuram/Music-Classes/nct-10332940,Directory / public search result,Local outreach lead; verify directly before email/WhatsApp,Thiruvananthapuram,raagatheertham|thiruvananthapuram|india|
e57411a38644,Saveri Music Academy,music_school,music / performing arts class,Thiruvananthapuram,Kerala,India,,,,,"Thiruvananthapuram music/arts education lead; directory-sourced row, verify contact before outreach.",Medium,Medium,https://www.justdial.com/Thiruvananthapuram/Music-Classes/nct-10332940,Directory / public search result,Local outreach lead; verify directly before email/WhatsApp,Thiruvananthapuram,saveri-music-academy|thiruvananthapuram|india|
6990acb64c9e,Wren Academy Of Music & Performing Arts,music_school,music / performing arts class,Thiruvananthapuram,Kerala,India,,,,,"Thiruvananthapuram music/arts education lead; directory-sourced row, verify contact before outreach.",Medium,Medium,https://www.justdial.com/Thiruvananthapuram/Music-Classes/nct-10332940,Directory / public search result,Local outreach lead; verify directly before email/WhatsApp,Thiruvananthapuram,wren-academy-of-music-performing-arts|thiruvananthapuram|india|
bd63479b4a45,Anoop Kammaran's Studio,recording_studio,recording / dubbing studio,Thiruvananthapuram,Kerala,India,,,,,"Thiruvananthapuram audio studio lead; directory-sourced row, verify contact before outreach.",Medium,Medium,https://www.justdial.com/Thiruvananthapuram/Audio-Recording-Studios/nct-10024547,Directory / public search result,Local outreach lead; verify directly before email/WhatsApp,Thiruvananthapuram,anoop-kammaran-s-studio|thiruvananthapuram|india|
3c0111918768,Ashwathy Digital Studio,recording_studio,recording / dubbing studio,Thiruvananthapuram,Kerala,India,,,,,"Thiruvananthapuram audio studio lead; directory-sourced row, verify contact before outreach.",Medium,Medium,https://www.justdial.com/Thiruvananthapuram/Audio-Recording-Studios/nct-10024547,Directory / public search result,Local outreach lead; verify directly before email/WhatsApp,Thiruvananthapuram,ashwathy-digital-studio|thiruvananthapuram|india|
426da8536481,Bensun Creations,recording_studio,recording / dubbing studio,Thiruvananthapuram,Kerala,India,,,,,"Thiruvananthapuram audio studio lead; directory-sourced row, verify contact before outreach.",Medium,Medium,https://www.justdial.com/Thiruvananthapuram/Audio-Recording-Studios/nct-10024547,Directory / public search result,Local outreach lead; verify directly before email/WhatsApp,Thiruvananthapuram,bensun-creations|thiruvananthapuram|india|
501dc765367a,Broadland Atmos,recording_studio,recording / dubbing studio,Thiruvananthapuram,Kerala,India,,,,,"Thiruvananthapuram audio studio lead; directory-sourced row, verify contact before outreach.",Medium,Medium,https://www.justdial.com/Thiruvananthapuram/Audio-Recording-Studios/nct-10024547,Directory / public search result,Local outreach lead; verify directly before email/WhatsApp,Thiruvananthapuram,broadland-atmos|thiruvananthapuram|india|
00cd790bad03,Grace Digital Audio Recording Studio,recording_studio,recording / dubbing studio,Thiruvananthapuram,Kerala,India,,,,,"Thiruvananthapuram audio studio lead; directory-sourced row, verify contact before outreach.",Medium,Medium,https://www.justdial.com/Thiruvananthapuram/Audio-Recording-Studios/nct-10024547,Directory / public search result,Local outreach lead; verify directly before email/WhatsApp,Thiruvananthapuram,grace-digital-audio-recording-studio|thiruvananthapuram|india|
177ff9fd4f40,Increation Media,recording_studio,recording / dubbing studio,Thiruvananthapuram,Kerala,India,,,,,"Thiruvananthapuram audio studio lead; directory-sourced row, verify contact before outreach.",Medium,Medium,https://www.justdial.com/Thiruvananthapuram/Audio-Recording-Studios/nct-10024547,Directory / public search result,Local outreach lead; verify directly before email/WhatsApp,Thiruvananthapuram,increation-media|thiruvananthapuram|india|
e9b425318ee0,K K Digital,recording_studio,recording / dubbing studio,Thiruvananthapuram,Kerala,India,,,,,"Thiruvananthapuram audio studio lead; directory-sourced row, verify contact before outreach.",Medium,Medium,https://www.justdial.com/Thiruvananthapuram/Audio-Recording-Studios/nct-10024547,Directory / public search result,Local outreach lead; verify directly before email/WhatsApp,Thiruvananthapuram,k-k-digital|thiruvananthapuram|india|
77ef473b1f1b,Kappa TV / Kappa Originals,recording_studio,music media / production house,Thiruvananthapuram,Kerala,India,https://www.kappa.tv/,,Music media/label pipeline connected to Malayalam independent music; verify current contact.,,,High,Medium,https://en.wikipedia.org/wiki/Kappa_TV,Official / public web,Independent music media/artist discovery partnership,Thiruvananthapuram,kappa-tv-kappa-originals|thiruvananthapuram|india|https-www-kappa-tv
be677915f1b4,MS Music Factory,recording_studio,recording / dubbing studio,Thiruvananthapuram,Kerala,India,,,,,"Thiruvananthapuram audio studio lead; directory-sourced row, verify contact before outreach.",Medium,Medium,https://www.justdial.com/Thiruvananthapuram/Audio-Recording-Studios/nct-10024547,Directory / public search result,Local outreach lead; verify directly before email/WhatsApp,Thiruvananthapuram,ms-music-factory|thiruvananthapuram|india|
a921efc97d6b,Mexico Visual Media,recording_studio,recording / dubbing studio,Thiruvananthapuram,Kerala,India,,,,,"Thiruvananthapuram audio studio lead; directory-sourced row, verify contact before outreach.",Medium,Medium,https://www.justdial.com/Thiruvananthapuram/Audio-Recording-Studios/nct-10024547,Directory / public search result,Local outreach lead; verify directly before email/WhatsApp,Thiruvananthapuram,mexico-visual-media|thiruvananthapuram|india|
4c8372dbd98f,Music City Studios & School of Arts,recording_studio,recording / dubbing studio,Thiruvananthapuram,Kerala,India,,,,,"Thiruvananthapuram audio studio lead; directory-sourced row, verify contact before outreach.",Medium,Medium,https://www.justdial.com/Thiruvananthapuram/Audio-Recording-Studios/nct-10024547,Directory / public search result,Local outreach lead; verify directly before email/WhatsApp,Thiruvananthapuram,music-city-studios-school-of-arts|thiruvananthapuram|india|
63862b6612f5,TKA Studios,recording_studio,recording / dubbing studio,Thiruvananthapuram,Kerala,India,,,,,"Thiruvananthapuram audio studio lead; directory-sourced row, verify contact before outreach.",Medium,Medium,https://www.justdial.com/Thiruvananthapuram/Audio-Recording-Studios/nct-10024547,Directory / public search result,Local outreach lead; verify directly before email/WhatsApp,Thiruvananthapuram,tka-studios|thiruvananthapuram|india|
8c2c5a4c6659,Trivandrum Voice Ganamela,recording_studio,recording / dubbing studio,Thiruvananthapuram,Kerala,India,,,,,"Thiruvananthapuram audio studio lead; directory-sourced row, verify contact before outreach.",Medium,Medium,https://www.justdial.com/Thiruvananthapuram/Audio-Recording-Studios/nct-10024547,Directory / public search result,Local outreach lead; verify directly before email/WhatsApp,Thiruvananthapuram,trivandrum-voice-ganamela|thiruvananthapuram|india|
b57d4bb867b5,Bunkface,artist,band,Kuala Lumpur,Kuala Lumpur,Malaysia,https://www.instagram.com/bunkface/,@bunkface,,,Malaysian pop-punk/rock band; youth scene mapping.,Medium,Medium,https://www.instagram.com/bunkface/,Official / public web,"Higher-ed, choir, venue or contemporary worship route",Kuala Lumpur,bunkface|kuala-lumpur|malaysia|https-www-instagram-com-bunkface
51f083645057,Yuna,artist,singer-songwriter,Kuala Lumpur,Kuala Lumpur,Malaysia,https://www.yunamusic.com/,@yuna,,,International Malaysian singer-songwriter.,High,High,https://www.yunamusic.com/,Official / public web,"Higher-ed, choir, venue or contemporary worship route",Kuala Lumpur,yuna|kuala-lumpur|malaysia|https-www-yunamusic-com
17e255edc060,Zee Avi,artist,singer-songwriter,Kuala Lumpur,Kuala Lumpur,Malaysia,https://www.instagram.com/zee.avi/,@zee.avi,,,Malaysian singer-songwriter; acoustic/indie scene lead.,Medium,Medium,https://www.instagram.com/zee.avi/,Official / public web,"Higher-ed, choir, venue or contemporary worship route",Kuala Lumpur,zee-avi|kuala-lumpur|malaysia|https-www-instagram-com-zee-avi
002cbb6bd0e3,Dithyrambic Singers,choir,choir,Kuala Lumpur,Kuala Lumpur,Malaysia,https://www.facebook.com/dithyrambicsingers/,,,,Malaysian choir lead; verify current activity.,Medium,Medium,https://www.facebook.com/dithyrambicsingers/,Official / public web,"Higher-ed, choir, venue or contemporary worship route",Kuala Lumpur,dithyrambic-singers|kuala-lumpur|malaysia|https-www-facebook-com-dithyrambicsingers
c5adafd5529f,The Kuala Lumpur Children's Choir,choir,children's choir,Kuala Lumpur,Kuala Lumpur,Malaysia,https://www.klchildrenschoir.com/,,,,Children/youth choir lead.,High,High,https://www.klchildrenschoir.com/,Official / public web,"Higher-ed, choir, venue or contemporary worship route",Kuala Lumpur,the-kuala-lumpur-children-s-choir|kuala-lumpur|malaysia|https-www-klchildrenschoir-com
560958c107bb,Young Choral Academy,choir,choral academy,Kuala Lumpur,Kuala Lumpur,Malaysia,https://youngchoral.com/,,,,Major Malaysian choral training organisation.,Highest,High,https://youngchoral.com/,Official / public web,"Higher-ed, choir, venue or contemporary worship route",Kuala Lumpur,young-choral-academy|kuala-lumpur|malaysia|https-youngchoral-com
7809fbd9f398,HTBB Church Kuala Lumpur,innovative_church,contemporary church,Kuala Lumpur,Kuala Lumpur,Malaysia,https://www.htbb.org/,@htbbkl,,,Contemporary urban church with strong community/music potential.,High,High,https://www.htbb.org/,Official / public web,"Higher-ed, choir, venue or contemporary worship route",Kuala Lumpur,htbb-church-kuala-lumpur|kuala-lumpur|malaysia|https-www-htbb-org
af7ea6def34a,SIBKL,innovative_church,contemporary church,Kuala Lumpur,Kuala Lumpur,Malaysia,https://sibkl.org.my/,@sibkl,,,Large contemporary worship church; review fit before outreach.,High,High,https://sibkl.org.my/,Official / public web,"Higher-ed, choir, venue or contemporary worship route",Kuala Lumpur,sibkl|kuala-lumpur|malaysia|https-sibkl-org-my
5c1c44f0ee1b,Bentley Music Academy,music_school,music academy,Kuala Lumpur,Selangor,Malaysia,https://www.bentleymusic.com/academy/,,,,Music academy tied to major instrument retailer/community.,High,High,https://www.bentleymusic.com/academy/,Official / public web,"Higher-ed, choir, venue or contemporary worship route",Kuala Lumpur,bentley-music-academy|kuala-lumpur|malaysia|https-www-bentleymusic-com-academy
5ec943c7401c,Yamaha Music School Malaysia,music_school,music school network,Kuala Lumpur,Kuala Lumpur,Malaysia,https://my.yamaha.com/,,,,Large music school network.,High,High,https://my.yamaha.com/,Official / public web,"Higher-ed, choir, venue or contemporary worship route",Kuala Lumpur,yamaha-music-school-malaysia|kuala-lumpur|malaysia|https-my-yamaha-com
5f8cce2c78ce,ASWARA Faculty of Music,music_university,arts university faculty,Kuala Lumpur,Federal Territory of Kuala Lumpur,Malaysia,https://www.aswara.edu.my/,,,,National arts academy with music faculty; verify current contacts.,High,High,https://www.aswara.edu.my/,Official / public web,"Higher-ed, choir, venue or contemporary worship route",Kuala Lumpur,aswara-faculty-of-music|kuala-lumpur|malaysia|https-www-aswara-edu-my
8568807d4a45,International College of Music (ICOM),music_university,contemporary music college,Kuala Lumpur,Selangor,Malaysia,https://icom.edu.my/,,,,Contemporary music college; strong workshop fit.,Highest,High,https://icom.edu.my/,Official / public web,"Higher-ed, choir, venue or contemporary worship route",Kuala Lumpur,international-college-of-music-icom|kuala-lumpur|malaysia|https-icom-edu-my
df8121cac38d,UCSI Institute of Music,music_university,university music institute,Kuala Lumpur,Federal Territory of Kuala Lumpur,Malaysia,https://music.ucsiuniversity.edu.my/,,,,Major Malaysian university music institute.,Highest,High,https://music.ucsiuniversity.edu.my/,Official / public web,"Higher-ed, choir, venue or contemporary worship route",Kuala Lumpur,ucsi-institute-of-music|kuala-lumpur|malaysia|https-music-ucsiuniversity-edu-my
7d4f92d175f0,Ark Studios Malaysia,recording_studio,recording studio,Kuala Lumpur,Kuala Lumpur,Malaysia,https://arkstudios.com.my/,,,,Recording studio lead; verify current contact.,Medium,Medium,https://arkstudios.com.my/,Official / public web,"Higher-ed, choir, venue or contemporary worship route",Kuala Lumpur,ark-studios-malaysia|kuala-lumpur|malaysia|https-arkstudios-com-my
c642a1e4a3be,Mastering One,recording_studio,mastering studio,Kuala Lumpur,Kuala Lumpur,Malaysia,https://www.masteringone.com/,,,,Mastering/production lead in Malaysia.,Medium,Medium,https://www.masteringone.com/,Official / public web,"Higher-ed, choir, venue or contemporary worship route",Kuala Lumpur,mastering-one|kuala-lumpur|malaysia|https-www-masteringone-com
e81830bc1bd8,Bobo KL,venue,live music lounge,Kuala Lumpur,Kuala Lumpur,Malaysia,https://www.bobo.my/,@bobokualalumpur,,,Cabaret/jazz/pop live music lounge; strong vocalist route.,High,High,https://www.bobo.my/,Official / public web,"Higher-ed, choir, venue or contemporary worship route",Kuala Lumpur,bobo-kl|kuala-lumpur|malaysia|https-www-bobo-my
a9ed64a591ab,Jao Tim,venue,live music / arts venue,Kuala Lumpur,Kuala Lumpur,Malaysia,https://www.jaotim.com/,@jaotimkl,,,Creative arts/live performance venue.,High,High,https://www.jaotim.com/,Official / public web,"Higher-ed, choir, venue or contemporary worship route",Kuala Lumpur,jao-tim|kuala-lumpur|malaysia|https-www-jaotim-com
4ba93f69c5ca,No Black Tie,venue,jazz / live music venue,Kuala Lumpur,Kuala Lumpur,Malaysia,https://noblacktie.com.my/,@noblacktiekl,,,Iconic KL jazz/live music venue.,Highest,High,https://noblacktie.com.my/,Official / public web,"Higher-ed, choir, venue or contemporary worship route",Kuala Lumpur,no-black-tie|kuala-lumpur|malaysia|https-noblacktie-com-my
d2cefff8fc90,REXKL,venue,creative arts venue,Kuala Lumpur,Kuala Lumpur,Malaysia,https://www.rexkl.com/,@rex.kl,,,Creative community and events venue.,Medium,Medium,https://www.rexkl.com/,Official / public web,"Higher-ed, choir, venue or contemporary worship route",Kuala Lumpur,rexkl|kuala-lumpur|malaysia|https-www-rexkl-com
7535dddf8c5e,DUMC - Damansara Utama Methodist Church,innovative_church,contemporary church,Petaling Jaya,Selangor,Malaysia,https://dumc.my/,@dumcmy,,,Large contemporary church with worship/community ecosystem.,High,High,https://dumc.my/,Official / public web,"Higher-ed, choir, venue or contemporary worship route",Petaling Jaya,dumc-damansara-utama-methodist-church|petaling-jaya|malaysia|https-dumc-my
9d9d47a2ff08,Merdekarya,venue,indie live venue,Petaling Jaya,Selangor,Malaysia,https://www.merdekarya.com/,,,,Indie singer-songwriter venue.,High,High,https://www.merdekarya.com/,Official / public web,"Higher-ed, choir, venue or contemporary worship route",Petaling Jaya,merdekarya|petaling-jaya|malaysia|https-www-merdekarya-com
cc41e16af808,Acts Church Malaysia,innovative_church,contemporary church,Subang Jaya,Selangor,Malaysia,https://acts.org.my/,,,,Youth/campus-oriented contemporary church network.,Medium,Medium,https://acts.org.my/,Official / public web,"Higher-ed, choir, venue or contemporary worship route",Subang Jaya,acts-church-malaysia|subang-jaya|malaysia|https-acts-org-my
a588432def77,Mascato Youth Choir,choir,youth choir,Swakopmund / Windhoek,Erongo / Khomas,Namibia,https://www.mascato.org/,,,,High-level Namibian youth choir; strong choral lead.,High,High,https://www.mascato.org/,Official / public web,"Music education, choir/gospel, venue or artist outreach",Swakopmund / Windhoek,mascato-youth-choir|swakopmund-windhoek|namibia|https-www-mascato-org
22f981dd9b63,College of the Arts Windhoek,music_university,arts college,Windhoek,Khomas,Namibia,https://www.cota.na/,,,,Namibia arts/music education anchor.,High,High,https://www.cota.na/,Official / public web,"Music education, choir/gospel, venue or artist outreach",Windhoek,college-of-the-arts-windhoek|windhoek|namibia|https-www-cota-na
a01061b8f626,National Theatre of Namibia,venue,performing arts venue,Windhoek,Khomas,Namibia,https://ntn.org.na/,,,,National venue for performing arts.,Medium,Medium,https://ntn.org.na/,Official / public web,"Music education, choir/gospel, venue or artist outreach",Windhoek,national-theatre-of-namibia|windhoek|namibia|https-ntn-org-na
ba3ced0530f4,Warehouse Theatre Windhoek,venue,live music / theatre venue,Windhoek,Khomas,Namibia,https://warehousetheatre.com.na/,,,,Windhoek live arts venue; scene mapping.,High,High,https://warehousetheatre.com.na/,Official / public web,"Music education, choir/gospel, venue or artist outreach",Windhoek,warehouse-theatre-windhoek|windhoek|namibia|https-warehousetheatre-com-na
421cedc460ab,MICappella,a_cappella_group,professional a cappella group,Singapore,Singapore,Singapore,https://www.micappella.com/,@micappella,,,Professional Singapore a cappella group with strong pop/vocal arrangement credibility.,Highest,High,https://www.micappella.com/,Official / public web,Vocal harmony / choir / rhythm training partnership,Singapore,micappella|singapore|singapore|https-www-micappella-com
080e7362cda7,NTU CAC Harmonix,a_cappella_group,university a cappella,Singapore,Singapore,Singapore,https://ntucac.com/harmonix/,@ntuharmonix,cac-harmonix@e.ntu.edu.sg,,NTU contemporary a cappella club; direct university singing community.,Highest,High,https://ntucac.com/harmonix/,Official / public web,Vocal harmony / choir / rhythm training partnership,Singapore,ntu-cac-harmonix|singapore|singapore|https-ntucac-com-harmonix
5ba45741f876,NUS Resonance,a_cappella_group,university a cappella,Singapore,Singapore,Singapore,https://www.nusresonance.com/,@nusresonance,contact@nusresonance.com,,Pioneer collegiate a cappella group from NUS; strong campus vocal community.,Highest,High,https://www.nusresonance.com/,Official / public web,Vocal harmony / choir / rhythm training partnership,Singapore,nus-resonance|singapore|singapore|https-www-nusresonance-com
eabe3850b352,SMU VOIX,a_cappella_group,university a cappella,Singapore,Singapore,Singapore,https://vivace.smu.edu.sg/explore/acf/music/smu-voix,@smuvoix,,,SMU premier a cappella club; highly relevant for youth vocal workshops.,Highest,High,https://vivace.smu.edu.sg/explore/acf/music/smu-voix,Official / public web,Vocal harmony / choir / rhythm training partnership,Singapore,smu-voix|singapore|singapore|https-vivace-smu-edu-sg-explore-acf-music-smu-voix
9abcf8bab102,Vocaluptuous,a_cappella_group,professional vocal group,Singapore,Singapore,Singapore,https://www.vocaluptuous.com/,,,,Established Singapore vocal harmony group; good for a cappella / vocal arranging pathway.,High,High,https://www.vocaluptuous.com/,Official / public web,Vocal harmony / choir / rhythm training partnership,Singapore,vocaluptuous|singapore|singapore|https-www-vocaluptuous-com
afe1d06682a2,Charlie Lim,artist,singer-songwriter / contemporary artist,Singapore,Singapore,Singapore,https://www.charlielim.net/,@charlielim,,,Singapore singer-songwriter/producer; high-signal contemporary artist.,High,High,https://www.charlielim.net/,Official / public web,Artist collaboration / guest session / scene mapping,Singapore,charlie-lim|singapore|singapore|https-www-charlielim-net
ae4a7ad5703e,Gentle Bones,artist,singer-songwriter / contemporary artist,Singapore,Singapore,Singapore,https://www.gentlebones.com/,@gentlebonesmusic,,,Mainstream Singapore pop artist; useful for scene mapping.,Medium,High,https://www.gentlebones.com/,Official / public web,Artist collaboration / guest session / scene mapping,Singapore,gentle-bones|singapore|singapore|https-www-gentlebones-com
56a100351ad6,Linying,artist,singer-songwriter / contemporary artist,Singapore,Singapore,Singapore,https://www.linyingmusic.com/,@linyingmusic,,,Singapore singer-songwriter; strong indie/pop audience.,Medium,High,https://www.linyingmusic.com/,Official / public web,Artist collaboration / guest session / scene mapping,Singapore,linying|singapore|singapore|https-www-linyingmusic-com
04b19dd748f7,Shye,artist,singer-songwriter / contemporary artist,Singapore,Singapore,Singapore,https://www.shyemusic.com/,@shye.mp3,,,Young Singapore indie-pop artist/producer; youth audience fit.,Medium,High,https://www.shyemusic.com/,Official / public web,Artist collaboration / guest session / scene mapping,Singapore,shye|singapore|singapore|https-www-shyemusic-com
0c4d1dbbe071,SMU Chamber Choir,choir,university choir,Singapore,Singapore,Singapore,https://vivace.smu.edu.sg/,,,,Campus choir lead for choral/community outreach.,Medium,High,https://vivace.smu.edu.sg/,Official / public web,Vocal harmony / choir / rhythm training partnership,Singapore,smu-chamber-choir|singapore|singapore|https-vivace-smu-edu-sg
c9e9b9bd283f,Singapore Lyric Opera Chorus,choir,opera chorus,Singapore,Singapore,Singapore,https://www.singaporelyricopera.com/,,,,Opera/choral network with experienced singers.,High,High,https://www.singaporelyricopera.com/,Official / public web,Vocal harmony / choir / rhythm training partnership,Singapore,singapore-lyric-opera-chorus|singapore|singapore|https-www-singaporelyricopera-com
6247bbf049a1,Singapore Symphony Choruses,choir,symphony chorus / youth choir,Singapore,Singapore,Singapore,https://www.sso.org.sg/choruses,,,,Formal choral network attached to the Singapore Symphony Group.,High,High,https://www.sso.org.sg/choruses,Official / public web,Vocal harmony / choir / rhythm training partnership,Singapore,singapore-symphony-choruses|singapore|singapore|https-www-sso-org-sg-choruses
df29f9222d80,Voices of Singapore,choir,national choral organisation,Singapore,Singapore,Singapore,https://www.voicesofsingapore.com/,@voicesofsingapore,,,Large singing organisation with community and children's choir programmes.,Highest,High,https://www.voicesofsingapore.com/,Official / public web,Vocal harmony / choir / rhythm training partnership,Singapore,voices-of-singapore|singapore|singapore|https-www-voicesofsingapore-com
aa6333e0f280,City Harvest Church Singapore,innovative_church,contemporary worship church,Singapore,Singapore,Singapore,https://www.chc.org.sg/,@chcsg,,,Large contemporary worship/music ecosystem.,High,High,https://www.chc.org.sg/,Official / public web,"Campus/community event, worship musician workshop, or vocal performance outreach",Singapore,city-harvest-church-singapore|singapore|singapore|https-www-chc-org-sg
2ce853dccd6b,Cornerstone Community Church Singapore,innovative_church,contemporary worship church,Singapore,Singapore,Singapore,https://www.cscc.org.sg/,@cornerstonesg,,,Contemporary church with strong worship/media presence.,Medium,High,https://www.cscc.org.sg/,Official / public web,"Campus/community event, worship musician workshop, or vocal performance outreach",Singapore,cornerstone-community-church-singapore|singapore|singapore|https-www-cscc-org-sg
7fe0b56ef925,Heart of God Church,innovative_church,youth contemporary church,Singapore,Singapore,Singapore,https://heartofgodchurch.org/,@hogc,,,Youth-focused contemporary church with strong media/music culture; review alignment before outreach.,Highest,High,https://heartofgodchurch.org/,Official / public web,"Campus/community event, worship musician workshop, or vocal performance outreach",Singapore,heart-of-god-church|singapore|singapore|https-heartofgodchurch-org
8313ee874d2c,New Creation Church,innovative_church,contemporary worship church,Singapore,Singapore,Singapore,https://newcreation.org.sg/,@newcreation.sg,,,Large contemporary worship community; review fit before outreach.,High,High,https://newcreation.org.sg/,Official / public web,"Campus/community event, worship musician workshop, or vocal performance outreach",Singapore,new-creation-church|singapore|singapore|https-newcreation-org-sg
abc1527ea8a2,Alternate Tone,music_school,private music school,Singapore,Singapore,Singapore,https://alternatetone.com/,@alternatetone,,,Contemporary music lessons and adult learner segment.,Medium,High,https://alternatetone.com/,Official / public web,Student workshop / parent-facing showcase / teacher partnership,Singapore,alternate-tone|singapore|singapore|https-alternatetone-com
7e7ac03c370f,Aureus Academy,music_school,private music school,Singapore,Singapore,Singapore,https://www.aureusacademy.com/,@aureusacademy,,,Large private music education network; strong youth/family market.,High,High,https://www.aureusacademy.com/,Official / public web,Student workshop / parent-facing showcase / teacher partnership,Singapore,aureus-academy|singapore|singapore|https-www-aureusacademy-com
