record_id,name,entity_type,subtype,city,state,country,website,instagram_handle,contact_email,phone,notes,priority,verification_level,source_url,source_type,recommended_outreach_angle,repo_cluster,dedupe_key
a71f3626dbca,Sonic Island Kochi,recording_studio,recording studio / production house,Kochi,Kerala,India,,,,,"Kochi/Kerala soundtrack studio lead; directory-sourced row, verify contact before outreach.",Medium,Medium,https://en.wikipedia.org/wiki/Vaazha_II%3A_Biopic_of_a_Billion_Bros_%28soundtrack%29,Directory / public search result,Local outreach lead; verify directly before email/WhatsApp,Kochi,sonic-island-kochi|kochi|india|
1b9db703252d,VTP Studios Kochi,recording_studio,recording studio / production house,Kochi,Kerala,India,,,,,"Kochi/Kerala soundtrack studio lead; directory-sourced row, verify contact before outreach.",Medium,Medium,https://en.wikipedia.org/wiki/Vaazha_II%3A_Biopic_of_a_Billion_Bros_%28soundtrack%29,Directory / public search result,Local outreach lead; verify directly before email/WhatsApp,Kochi,vtp-studios-kochi|kochi|india|
592e5f3013db,WatB Studios Kochi,recording_studio,recording studio / production house,Kochi,Kerala,India,,,,,"Kochi/Kerala soundtrack studio lead; directory-sourced row, verify contact before outreach.",Medium,Medium,https://en.wikipedia.org/wiki/Vaazha_II%3A_Biopic_of_a_Billion_Bros_%28soundtrack%29,Directory / public search result,Local outreach lead; verify directly before email/WhatsApp,Kochi,watb-studios-kochi|kochi|india|
3e6c16cf3d04,Cafe Papaya Kochi,venue,venue,Kochi,Kerala,India,https://www.instagram.com/cafepapaya/,@cafepapaya,,,Cultural cafe/live-event lead; verify current programming.,Medium,Medium,https://www.instagram.com/cafepapaya/,Official / public web,Artist/church/venue outreach,Kochi,cafe-papaya-kochi|kochi|india|https-www-instagram-com-cafepapaya
1205a9920dee,The Sooriya Festival / Kochi cultural circuit,venue,cultural programming venue,Kochi,Kerala,India,https://www.sooriyafestival.com/,,,,Kerala cultural programming lead; verify city-specific events.,Medium,Medium,https://www.sooriyafestival.com/,Official / public web,Artist/church/venue outreach,Kochi,the-sooriya-festival-kochi-cultural-circuit|kochi|india|https-www-sooriyafestival-com
bfada5d47e69,Aloysian Music Association,music_school,music class / academy,Mangalore,Karnataka,India,,,,,"Mangalore music education lead; directory-sourced row, verify contact before outreach.",Medium,Medium,https://www.justdial.com/Mangalore/Music-Classes/nct-10332940,Directory / public search result,Local outreach lead; verify directly before email/WhatsApp,Mangalore,aloysian-music-association|mangalore|india|
b10ff66203b8,Furtados School of Music Mangalore,music_school,music class / academy,Mangalore,Karnataka,India,,,,,"Mangalore music education lead; directory-sourced row, verify contact before outreach.",Medium,Medium,https://www.justdial.com/Mangalore/Music-Classes/nct-10332940,Directory / public search result,Local outreach lead; verify directly before email/WhatsApp,Mangalore,furtados-school-of-music-mangalore|mangalore|india|
6d68eb8573a8,Mangalore Music Academy,music_school,music class / academy,Mangalore,Karnataka,India,,,,,"Mangalore music education lead; directory-sourced row, verify contact before outreach.",Medium,Medium,https://www.justdial.com/Mangalore/Music-Classes/nct-10332940,Directory / public search result,Local outreach lead; verify directly before email/WhatsApp,Mangalore,mangalore-music-academy|mangalore|india|
e6bcdb7f33b8,Melodia Music Academy Mangalore,music_school,music class / academy,Mangalore,Karnataka,India,,,,,"Mangalore music education lead; directory-sourced row, verify contact before outreach.",Medium,Medium,https://www.justdial.com/Mangalore/Music-Classes/nct-10332940,Directory / public search result,Local outreach lead; verify directly before email/WhatsApp,Mangalore,melodia-music-academy-mangalore|mangalore|india|
545696d8a78e,Raga Music Academy Mangalore,music_school,music class / academy,Mangalore,Karnataka,India,,,,,"Mangalore music education lead; directory-sourced row, verify contact before outreach.",Medium,Medium,https://www.justdial.com/Mangalore/Music-Classes/nct-10332940,Directory / public search result,Local outreach lead; verify directly before email/WhatsApp,Mangalore,raga-music-academy-mangalore|mangalore|india|
67d96422372a,Rhythm Music Classes Mangalore,music_school,music class / academy,Mangalore,Karnataka,India,,,,,"Mangalore music education lead; directory-sourced row, verify contact before outreach.",Medium,Medium,https://www.justdial.com/Mangalore/Music-Classes/nct-10332940,Directory / public search result,Local outreach lead; verify directly before email/WhatsApp,Mangalore,rhythm-music-classes-mangalore|mangalore|india|
4a82fcc1c1ca,Sangeetha Bharathi Foundation,music_school,music class / academy,Mangalore,Karnataka,India,,,,,"Mangalore music education lead; directory-sourced row, verify contact before outreach.",Medium,Medium,https://www.justdial.com/Mangalore/Music-Classes/nct-10332940,Directory / public search result,Local outreach lead; verify directly before email/WhatsApp,Mangalore,sangeetha-bharathi-foundation|mangalore|india|
5f0b899ac0d5,Shalom Music School Mangalore,music_school,music class / academy,Mangalore,Karnataka,India,,,,,"Mangalore music education lead; directory-sourced row, verify contact before outreach.",Medium,Medium,https://www.justdial.com/Mangalore/Music-Classes/nct-10332940,Directory / public search result,Local outreach lead; verify directly before email/WhatsApp,Mangalore,shalom-music-school-mangalore|mangalore|india|
ea698f7ccb99,St Cecilia Music School Mangalore,music_school,music class / academy,Mangalore,Karnataka,India,,,,,"Mangalore music education lead; directory-sourced row, verify contact before outreach.",Medium,Medium,https://www.justdial.com/Mangalore/Music-Classes/nct-10332940,Directory / public search result,Local outreach lead; verify directly before email/WhatsApp,Mangalore,st-cecilia-music-school-mangalore|mangalore|india|
c5785bfcddef,Western Institute of Music Mangalore,music_school,music class / academy,Mangalore,Karnataka,India,,,,,"Mangalore music education lead; directory-sourced row, verify contact before outreach.",Medium,Medium,https://www.justdial.com/Mangalore/Music-Classes/nct-10332940,Directory / public search result,Local outreach lead; verify directly before email/WhatsApp,Mangalore,western-institute-of-music-mangalore|mangalore|india|
913aceee8d97,Asha Audio Mangalore,recording_studio,audio recording studio,Mangalore,Karnataka,India,,,,,"Mangalore audio studio lead; directory-sourced row, verify contact before outreach.",Medium,Medium,https://www.justdial.com/Mangalore/Audio-Recording-Studios/nct-10024547,Directory / public search result,Local outreach lead; verify directly before email/WhatsApp,Mangalore,asha-audio-mangalore|mangalore|india|
472e69a983a7,Audio Lab Mangalore,recording_studio,audio recording studio,Mangalore,Karnataka,India,,,,,"Mangalore audio studio lead; directory-sourced row, verify contact before outreach.",Medium,Medium,https://www.justdial.com/Mangalore/Audio-Recording-Studios/nct-10024547,Directory / public search result,Local outreach lead; verify directly before email/WhatsApp,Mangalore,audio-lab-mangalore|mangalore|india|
a547d04605cf,Canara Digital Recording Studio,recording_studio,audio recording studio,Mangalore,Karnataka,India,,,,,"Mangalore audio studio lead; directory-sourced row, verify contact before outreach.",Medium,Medium,https://www.justdial.com/Mangalore/Audio-Recording-Studios/nct-10024547,Directory / public search result,Local outreach lead; verify directly before email/WhatsApp,Mangalore,canara-digital-recording-studio|mangalore|india|
4cedbe9a9337,Coastal Beats Studio,recording_studio,audio recording studio,Mangalore,Karnataka,India,,,,,"Mangalore audio studio lead; directory-sourced row, verify contact before outreach.",Medium,Medium,https://www.justdial.com/Mangalore/Audio-Recording-Studios/nct-10024547,Directory / public search result,Local outreach lead; verify directly before email/WhatsApp,Mangalore,coastal-beats-studio|mangalore|india|
3df1bd46764f,Magic Sound Studio Mangalore,recording_studio,audio recording studio,Mangalore,Karnataka,India,,,,,"Mangalore audio studio lead; directory-sourced row, verify contact before outreach.",Medium,Medium,https://www.justdial.com/Mangalore/Audio-Recording-Studios/nct-10024547,Directory / public search result,Local outreach lead; verify directly before email/WhatsApp,Mangalore,magic-sound-studio-mangalore|mangalore|india|
4e5c6fd3d2fe,Raga Studio Mangalore,recording_studio,audio recording studio,Mangalore,Karnataka,India,,,,,"Mangalore audio studio lead; directory-sourced row, verify contact before outreach.",Medium,Medium,https://www.justdial.com/Mangalore/Audio-Recording-Studios/nct-10024547,Directory / public search result,Local outreach lead; verify directly before email/WhatsApp,Mangalore,raga-studio-mangalore|mangalore|india|
e1c34772cbc9,Rhythm Recording Studio Mangalore,recording_studio,audio recording studio,Mangalore,Karnataka,India,,,,,"Mangalore audio studio lead; directory-sourced row, verify contact before outreach.",Medium,Medium,https://www.justdial.com/Mangalore/Audio-Recording-Studios/nct-10024547,Directory / public search result,Local outreach lead; verify directly before email/WhatsApp,Mangalore,rhythm-recording-studio-mangalore|mangalore|india|
5092d4fcfff9,Sound City Studio Mangalore,recording_studio,audio recording studio,Mangalore,Karnataka,India,,,,,"Mangalore audio studio lead; directory-sourced row, verify contact before outreach.",Medium,Medium,https://www.justdial.com/Mangalore/Audio-Recording-Studios/nct-10024547,Directory / public search result,Local outreach lead; verify directly before email/WhatsApp,Mangalore,sound-city-studio-mangalore|mangalore|india|
109ce3ee0a0a,Studio Seven Mangalore,recording_studio,audio recording studio,Mangalore,Karnataka,India,,,,,"Mangalore audio studio lead; directory-sourced row, verify contact before outreach.",Medium,Medium,https://www.justdial.com/Mangalore/Audio-Recording-Studios/nct-10024547,Directory / public search result,Local outreach lead; verify directly before email/WhatsApp,Mangalore,studio-seven-mangalore|mangalore|india|
00eea03d87f7,Tune Factory Mangalore,recording_studio,audio recording studio,Mangalore,Karnataka,India,,,,,"Mangalore audio studio lead; directory-sourced row, verify contact before outreach.",Medium,Medium,https://www.justdial.com/Mangalore/Audio-Recording-Studios/nct-10024547,Directory / public search result,Local outreach lead; verify directly before email/WhatsApp,Mangalore,tune-factory-mangalore|mangalore|india|
a11d3c3016ed,True School of Music,music_university,contemporary music college,Mumbai,Maharashtra,India,https://trueschool.in/,@trueschoolofmusic,,,Contemporary music college with performance/production focus.,High,High,https://trueschool.in/,Official / public web,National anchor / partner / referral path,Mumbai,true-school-of-music|mumbai|india|https-trueschool-in
befe80d73a6a,Island City Studios,recording_studio,recording studio,Mumbai,Maharashtra,India,https://www.islandcitystudios.com/,,,,High-end Mumbai recording studio; industry lead.,High,High,https://www.islandcitystudios.com/,Official / public web,National anchor / partner / referral path,Mumbai,island-city-studios|mumbai|india|https-www-islandcitystudios-com
a8fd67fbe2fb,Purple Haze Studios,recording_studio,recording studio,Mumbai,Maharashtra,India,https://www.instagram.com/purplehazestudios/,@purplehazestudios,,,Mumbai studio lead; verify via Instagram.,Medium,Medium,https://www.instagram.com/purplehazestudios/,Official / public web,National anchor / partner / referral path,Mumbai,purple-haze-studios|mumbai|india|https-www-instagram-com-purplehazestudios
d8253dcd6e0a,Yash Raj Films Studios,recording_studio,film/music production studio,Mumbai,Maharashtra,India,https://www.yashrajfilms.com/,,,,Major film/music production ecosystem; corporate/institutional route.,Medium,Medium,https://www.yashrajfilms.com/,Official / public web,National anchor / partner / referral path,Mumbai,yash-raj-films-studios|mumbai|india|https-www-yashrajfilms-com
2adf1f530c31,Blue Frog / Mumbai live music legacy network,venue,live venue / legacy lead,Mumbai,Maharashtra,India,https://en.wikipedia.org/wiki/Blue_Frog_(club),,,,Legacy venue/brand; use only for historical scene mapping.,Low,Low,https://en.wikipedia.org/wiki/Blue_Frog_(club),Official / public web,National anchor / partner / referral path,Mumbai,blue-frog-mumbai-live-music-legacy-network|mumbai|india|https-en-wikipedia-org-wiki-blue-frog-club
447d83ea9e7d,The Piano Man Jazz Club Delhi,venue,jazz club,New Delhi,Delhi,India,https://www.thepianoman.in/,@thepianomanjazzclub,,,Important jazz/listening-room network in India.,Highest,High,https://www.thepianoman.in/,Official / public web,National anchor / partner / referral path,New Delhi,the-piano-man-jazz-club-delhi|new-delhi|india|https-www-thepianoman-in
0b3c8f25d7e7,Gray Spark Audio & Sound Engineering Academy,recording_studio,audio school / studio,Pune,Maharashtra,India,https://www.graysparkacademy.com/,@graysparkaudio,,,Audio training and studio ecosystem; producer outreach.,High,High,https://www.graysparkacademy.com/,Official / public web,National anchor / partner / referral path,Pune,gray-spark-audio-sound-engineering-academy|pune|india|https-www-graysparkacademy-com
3289c497e97e,Lou Majaw,artist,artist,Shillong,Meghalaya,India,https://en.wikipedia.org/wiki/Lou_Majaw,,,,Shillong folk/rock elder and scene connector; verify direct contact.,Medium,Medium,https://en.wikipedia.org/wiki/Lou_Majaw,Official / public web,Scene mapping and local artist referral,Shillong,lou-majaw|shillong|india|https-en-wikipedia-org-wiki-lou-majaw
18df130c095c,Meba Ofilia,artist,artist,Shillong,Meghalaya,India,https://www.instagram.com/mebaofilia/,@mebaofilia,,,Shillong contemporary artist; youth/indie scene lead.,Medium,Medium,https://www.instagram.com/mebaofilia/,Official / public web,Scene mapping and local artist referral,Shillong,meba-ofilia|shillong|india|https-www-instagram-com-mebaofilia
10c928b23934,Soulmate,artist,artist,Shillong,Meghalaya,India,https://www.facebook.com/soulmateblues/,,,,Shillong blues band; strong local scene connector.,High,High,https://www.facebook.com/soulmateblues/,Official / public web,Scene mapping and local artist referral,Shillong,soulmate|shillong|india|https-www-facebook-com-soulmateblues
45a56c8a43e0,Shillong Chamber Choir,choir,chamber choir,Shillong,Meghalaya,India,https://www.youtube.com/c/ShillongChamberChoir,@shillongchamberchoir,,,India-famous chamber choir rooted in Shillong; high-signal vocal/community lead.,Highest,High,https://en.wikipedia.org/wiki/Shillong_Chamber_Choir,Official / public web,"Choir/vocal workshop, collaboration, music education referral",Shillong,shillong-chamber-choir|shillong|india|https-www-youtube-com-c-shillongchamberchoir
9d813a8b7af7,Andante Institute Of Contemporary Music,music_school,local music class / academy,Shillong,Meghalaya,India,,,,,"Shillong music education lead; directory-sourced row, verify contact before outreach.",Medium,Medium,https://www.justdial.com/Shillong/Music-Classes/nct-10332940,Directory / public search result,Local outreach lead; verify directly before email/WhatsApp,Shillong,andante-institute-of-contemporary-music|shillong|india|
01646f59ed22,Arnest Memorial Music School,music_school,local music class / academy,Shillong,Meghalaya,India,,,,,"Shillong music education lead; directory-sourced row, verify contact before outreach.",Medium,Medium,https://www.justdial.com/Shillong/Music-Classes/nct-10332940,Directory / public search result,Local outreach lead; verify directly before email/WhatsApp,Shillong,arnest-memorial-music-school|shillong|india|
8a5c6d12e30a,Assembly Institute Of Music,music_school,local music class / academy,Shillong,Meghalaya,India,,,,,"Shillong music education lead; directory-sourced row, verify contact before outreach.",Medium,Medium,https://www.justdial.com/Shillong/Music-Classes/nct-10332940,Directory / public search result,Local outreach lead; verify directly before email/WhatsApp,Shillong,assembly-institute-of-music|shillong|india|
b30874abd4bc,Harmini Preparatory Music,music_school,local music class / academy,Shillong,Meghalaya,India,,,,,"Shillong music education lead; directory-sourced row, verify contact before outreach.",Medium,Medium,https://www.justdial.com/Shillong/Music-Classes/nct-10332940,Directory / public search result,Local outreach lead; verify directly before email/WhatsApp,Shillong,harmini-preparatory-music|shillong|india|
0a5183d3eb90,IITV Music School Shillong,music_school,local music class / academy,Shillong,Meghalaya,India,,,,,"Shillong music education lead; directory-sourced row, verify contact before outreach.",Medium,Medium,https://www.justdial.com/Shillong/Music-Classes/nct-10332940,Directory / public search result,Local outreach lead; verify directly before email/WhatsApp,Shillong,iitv-music-school-shillong|shillong|india|
37090fbdfbae,Shillong School Of Music,music_school,local music class / academy,Shillong,Meghalaya,India,,,,,"Shillong music education lead; directory-sourced row, verify contact before outreach.",Medium,Medium,https://www.justdial.com/Shillong/Music-Classes/nct-10332940,Directory / public search result,Local outreach lead; verify directly before email/WhatsApp,Shillong,shillong-school-of-music|shillong|india|
12ad0361284d,Urban Raga,music_school,local music class / academy,Shillong,Meghalaya,India,,,,,"Shillong music education lead; directory-sourced row, verify contact before outreach.",Medium,Medium,https://www.justdial.com/Shillong/Music-Classes/nct-10332940,Directory / public search result,Local outreach lead; verify directly before email/WhatsApp,Shillong,urban-raga|shillong|india|
eeea844fa99a,Audiotech Recording Studio Shillong,recording_studio,recording studio,Shillong,Meghalaya,India,,,,,"Shillong recording/production lead; directory-sourced row, verify contact before outreach.",Medium,Medium,https://www.justdial.com/Shillong/Audio-Recording-Studios/nct-10024547,Directory / public search result,Local outreach lead; verify directly before email/WhatsApp,Shillong,audiotech-recording-studio-shillong|shillong|india|
db5ffa99289a,Chikmik Studio,recording_studio,recording studio,Shillong,Meghalaya,India,,,,,"Shillong recording/production lead; directory-sourced row, verify contact before outreach.",Medium,Medium,https://www.justdial.com/Shillong/Audio-Recording-Studios/nct-10024547,Directory / public search result,Local outreach lead; verify directly before email/WhatsApp,Shillong,chikmik-studio|shillong|india|
a02533d8d8f2,Merliham Arrangements,recording_studio,recording studio,Shillong,Meghalaya,India,,,,,"Shillong recording/production lead; directory-sourced row, verify contact before outreach.",Medium,Medium,https://www.justdial.com/Shillong/Audio-Recording-Studios/nct-10024547,Directory / public search result,Local outreach lead; verify directly before email/WhatsApp,Shillong,merliham-arrangements|shillong|india|
996c551f285a,Pine Town Recording Studio,recording_studio,recording studio,Shillong,Meghalaya,India,,,,,"Shillong recording/production lead; directory-sourced row, verify contact before outreach.",Medium,Medium,https://www.justdial.com/Shillong/Audio-Recording-Studios/nct-10024547,Directory / public search result,Local outreach lead; verify directly before email/WhatsApp,Shillong,pine-town-recording-studio|shillong|india|
c0ddb9bf52c4,ProVibes Project Recording Studio,recording_studio,recording studio,Shillong,Meghalaya,India,,,,,"Shillong recording/production lead; directory-sourced row, verify contact before outreach.",Medium,Medium,https://www.justdial.com/Shillong/Audio-Recording-Studios/nct-10024547,Directory / public search result,Local outreach lead; verify directly before email/WhatsApp,Shillong,provibes-project-recording-studio|shillong|india|
0bd0e0d0203f,Sabdarupa Studio,recording_studio,recording studio,Shillong,Meghalaya,India,,,,,"Shillong recording/production lead; directory-sourced row, verify contact before outreach.",Medium,Medium,https://www.justdial.com/Shillong/Audio-Recording-Studios/nct-10024547,Directory / public search result,Local outreach lead; verify directly before email/WhatsApp,Shillong,sabdarupa-studio|shillong|india|
0ac4a87ca62a,Shillong Prime Studio,recording_studio,recording studio,Shillong,Meghalaya,India,,,,,"Shillong recording/production lead; directory-sourced row, verify contact before outreach.",Medium,Medium,https://www.justdial.com/Shillong/Audio-Recording-Studios/nct-10024547,Directory / public search result,Local outreach lead; verify directly before email/WhatsApp,Shillong,shillong-prime-studio|shillong|india|
3bd1391c60da,Sur Bathiang Recording Studio,recording_studio,recording studio,Shillong,Meghalaya,India,,,,,"Shillong recording/production lead; directory-sourced row, verify contact before outreach.",Medium,Medium,https://www.justdial.com/Shillong/Audio-Recording-Studios/nct-10024547,Directory / public search result,Local outreach lead; verify directly before email/WhatsApp,Shillong,sur-bathiang-recording-studio|shillong|india|
ad5aa76480cf,Cloud 9 Shillong,venue,venue,Shillong,Meghalaya,India,https://www.tripadvisor.in/Attractions-g503702-Activities-c20-t99-Shillong_East_Khasi_Hills_District_Meghalaya.html,,,,Listed nightlife/live-music lead; verify current programming.,Medium,Medium,https://www.tripadvisor.in/Attractions-g503702-Activities-c20-t99-Shillong_East_Khasi_Hills_District_Meghalaya.html,Official / public web,Scene mapping and local artist referral,Shillong,cloud-9-shillong|shillong|india|https-www-tripadvisor-in-attractions-g503702-activities-c20-t99-shillong-east-khasi-hills-district-meghalaya-html
aa56c9f01357,Dylan's Café Shillong,venue,venue,Shillong,Meghalaya,India,https://www.instagram.com/dylanscafeshillong/,@dylanscafeshillong,,,Music-friendly cafe associated with Shillong youth/artist scene.,Medium,Medium,https://www.instagram.com/dylanscafeshillong/,Official / public web,Scene mapping and local artist referral,Shillong,dylan-s-caf-shillong|shillong|india|https-www-instagram-com-dylanscafeshillong
d0ad96d58e25,The Evening Club Shillong,venue,venue,Shillong,Meghalaya,India,https://ecshillong.com/the-evening-club/,@eveningclubshillong,,,Live music/performance venue in Shillong; good local artist connector.,High,High,https://ecshillong.com/the-evening-club/,Official / public web,Scene mapping and local artist referral,Shillong,the-evening-club-shillong|shillong|india|https-ecshillong-com-the-evening-club
ead5869b345b,Diostu Arts and Production,music_school,music / performing arts class,Thiruvananthapuram,Kerala,India,,,,,"Thiruvananthapuram music/arts education lead; directory-sourced row, verify contact before outreach.",Medium,Medium,https://www.justdial.com/Thiruvananthapuram/Music-Classes/nct-10332940,Directory / public search result,Local outreach lead; verify directly before email/WhatsApp,Thiruvananthapuram,diostu-arts-and-production|thiruvananthapuram|india|
1f7276e945cf,Kalyan Group Of Education Institutions,music_school,music / performing arts class,Thiruvananthapuram,Kerala,India,,,,,"Thiruvananthapuram music/arts education lead; directory-sourced row, verify contact before outreach.",Medium,Medium,https://www.justdial.com/Thiruvananthapuram/Music-Classes/nct-10332940,Directory / public search result,Local outreach lead; verify directly before email/WhatsApp,Thiruvananthapuram,kalyan-group-of-education-institutions|thiruvananthapuram|india|
36ffabf680be,Kavalam School Of Music and Research Centre,music_school,music / performing arts class,Thiruvananthapuram,Kerala,India,,,,,"Thiruvananthapuram music/arts education lead; directory-sourced row, verify contact before outreach.",Medium,Medium,https://www.justdial.com/Thiruvananthapuram/Music-Classes/nct-10332940,Directory / public search result,Local outreach lead; verify directly before email/WhatsApp,Thiruvananthapuram,kavalam-school-of-music-and-research-centre|thiruvananthapuram|india|
9ffdc9e913b1,Laasya Academy Of Bharathanatyam,music_school,music / performing arts class,Thiruvananthapuram,Kerala,India,,,,,"Thiruvananthapuram music/arts education lead; directory-sourced row, verify contact before outreach.",Medium,Medium,https://www.justdial.com/Thiruvananthapuram/Music-Classes/nct-10332940,Directory / public search result,Local outreach lead; verify directly before email/WhatsApp,Thiruvananthapuram,laasya-academy-of-bharathanatyam|thiruvananthapuram|india|
167fc20fd27e,Mozart Music Academy,music_school,music / performing arts class,Thiruvananthapuram,Kerala,India,,,,,"Thiruvananthapuram music/arts education lead; directory-sourced row, verify contact before outreach.",Medium,Medium,https://www.justdial.com/Thiruvananthapuram/Music-Classes/nct-10332940,Directory / public search result,Local outreach lead; verify directly before email/WhatsApp,Thiruvananthapuram,mozart-music-academy|thiruvananthapuram|india|
22656a836bea,Natyaveda College Of Performing Arts,music_school,music / performing arts class,Thiruvananthapuram,Kerala,India,,,,,"Thiruvananthapuram music/arts education lead; directory-sourced row, verify contact before outreach.",Medium,Medium,https://www.justdial.com/Thiruvananthapuram/Music-Classes/nct-10332940,Directory / public search result,Local outreach lead; verify directly before email/WhatsApp,Thiruvananthapuram,natyaveda-college-of-performing-arts|thiruvananthapuram|india|
