cluster,city,state,country,institution_name,archetype,contact_name,contact_email,instagram_handle,phone,website,recommended_topic,priority,personalized_hook,format_recommendation,language_confidence,notes,send_via,verified
Thailand,Chiang Mai,,Thailand,Duriyasilp College of Music — Payap University,conservatory,College of Music Office,info_english@payap.ac.th,@music.pyu,+66 53 851 478,https://music.payap.ac.th,Sacred Music arrangement + Vocal Harmony,High,"Founded by the Church of Christ in Thailand, Payap's Duriyasilp College of Music and its choral tradition make a vocal-harmony and sacred-music arrangement session a strong fit.",Full-day workshop,high,"Phone +66 53 851478 ext 6102; Intl info_english@payap.ac.th. Kaewnawarat Campus, Chiang Mai. FB @music.pyu.",INSTANTLY_OK,high
Thailand,Bangkok,,Thailand,International School Bangkok (ISB),international_school,Panther Music Dept,admissions@isb.ac.th,@isbangkok,+66 2 963 5800,https://www.isb.ac.th,Multi-instrumental residency + Jazz Improvisation,Highest,"Thailand's premier international school since 1951 — the Panther Music programme and ensembles make ISB a natural setting for a week-long visiting-artist residency including jazz for senior students.",Week-long residency,high,Route via admissions@isb.ac.th to Panther Music / Head of Music.,INSTANTLY_OK,medium
Thailand,Bangkok,,Thailand,NIST International School,international_school,,admissions@nist.ac.th,@nistschool,+66 2 017 5888,https://www.nist.ac.th,Guest artist masterclass,High,"NIST's IB arts programme and active ensembles would translate a visiting-artist workshop straight into performable results.",Full-day workshop,medium,Route via admissions@nist.ac.th to Head of Music.,INSTANTLY_OK,low
Thailand,Chiang Mai,,Thailand,Chiang Mai International School (CMIS),international_school,,admissions@cmis.ac.th,@cmischiangmai,+66 53 306 222,https://www.cmis.ac.th,Multi-instrumental masterclass,Medium,"Founded 1954 with an American curriculum and international perspective, CMIS is a natural Chiang Mai stop for a multi-instrumental masterclass.",Half-day intensive,medium,Est. 1954. Route via admissions@cmis.ac.th.,INSTANTLY_OK,low
Thailand,Chiang Mai,,Thailand,Prem Tinsulanonda International School,international_school,,admissions@premcenter.org,@premschool,+66 53 301 500,https://www.premcenter.org,Multi-instrumental masterclass,Medium,"Prem's IB campus and arts focus make a visiting multi-instrumentalist's masterclass a good fit for your Chiang Mai students.",Half-day intensive,low,IB boarding near Chiang Mai. Route via admissions@premcenter.org.,INSTANTLY_OK,low
Thailand,Bangkok,,Thailand,Saxophone Pub,jazz_venue,,saxophonepub@gmail.com,@saxophonepub,+66 2 246 5472,http://www.saxophonepub.com,Performance + improvisation workshop,High,"As one of Bangkok's oldest and most-loved jazz clubs since 1987 at 3/8 Phayathai Road, Saxophone Pub is the right room for a visiting musician to play and run a workshop alongside.",Performance + 2-hour workshop,high,"3/8 Phayathai Rd, Ratchathewi; +66 2 246 5472. IG @saxophonepub. Verify email via site/IG.",INSTANTLY_OK,high
Thailand,Bangkok,,Thailand,Brown Sugar,jazz_venue,,brownsugarbangkok@gmail.com,@brownsugarbangkok,+66 89 499 1378,https://www.brownsugarbangkok.com,Performance + workshop combo,Medium,"A jazz and blues haven since 1985 hosting local and international acts — happy to perform and offer a short improvisation workshop.",Performance,medium,Verify email via site/IG @brownsugarbangkok.,INSTANTLY_OK,low
Thailand,Bangkok,,Thailand,The Bamboo Bar (Mandarin Oriental),jazz_venue,,mobkk-reservations@mohg.com,@mo_bangkok,+66 2 659 9000,https://www.mandarinoriental.com/bangkok,Performance,Medium,"Your colonial-style jazz room with nightly live music is a flexible spot for a visiting musician — happy to play whichever set fits your programming.",Performance,medium,Historic hotel jazz bar; route via Mandarin Oriental Bangkok.,INSTANTLY_OK,low
Thailand,Chiang Mai,,Thailand,Church of Christ in Thailand choirs (Chiang Mai),church_choir,via Payap / CCT music office,info_english@payap.ac.th,,+66 53 851 478,https://music.payap.ac.th,Sacred music arrangement workshop,Medium,"HAND-WRITE. The Church of Christ in Thailand sustains active choirs around Chiang Mai — a sacred-music arrangement and vocal-harmony session would be a meaningful contribution. Reach via the Payap / CCT music office.",Half-day intensive,medium,Hand-write via Payap Duriyasilp / CCT music office.,DO_NOT_USE_INSTANTLY,medium
Zimbabwe+Namibia,Harare,,Zimbabwe,Zimbabwe College of Music,conservatory,Rachel Chigwanda (Executive Director),registry@zcm.co.zw,,+263 242 749076,https://zcm.co.zw,Music Theory & Ear Training (Indian-influenced) + Riffs Method,Highest,"Founded 1948 with a multicultural philosophy spanning Western classical, Zimbabwean traditional and a BMus in Jazz and Ethnomusicology — Executive Director Rachel Chigwanda leads exactly the institution where an Indian multi-instrumentalist's cross-tradition residency would resonate.",Week-long residency,high,"Exec Director Rachel Chigwanda. registry@zcm.co.zw / +263 242 749076/7. C3 Civic Centre, Rotten Row, Harare. FB @www.zcm.co.zw.",INSTANTLY_OK,high
Zimbabwe+Namibia,Harare,,Zimbabwe,Music Crossroads Academy Zimbabwe,contemporary_academy,Academy Office,mczimbabwe@music-crossroads.net,@musiccrossroadszimbabwe,+263 776 179455,https://www.music-crossroads.net,The Riffs Method + Live Performance Coaching,High,"Your development-oriented professional music certificate programmes make the Riffs Method and live-performance coaching a directly applicable addition for your students.",Full-day workshop,high,"mczimbabwe@music-crossroads.net / +263 776 179 455. 48 Selous Avenue, Harare. FB @MCZimbabwe.Trust.",INSTANTLY_OK,high
Zimbabwe+Namibia,Harare,,Zimbabwe,University of Zimbabwe Department of Music & Musicology,conservatory,Dept of Music,music@uz.ac.zw,@univofzim,+263 242 303211,https://www.uz.ac.zw,Music Theory & Ear Training,Medium,"A cross-tradition theory and ear-training session from a multi-instrumentalist would complement your formal music and musicology curriculum.",Full-day workshop,medium,Route via UZ Department of Music / faculty office.,INSTANTLY_OK,low
Zimbabwe+Namibia,Gweru,,Zimbabwe,Midlands State University — Music Business Musicology & Technology,conservatory,Dept Office,music@staff.msu.ac.zw,@midlandsstateuniversity,+263 542 260404,https://ww5.msu.ac.zw,Modern Music Production / DAW + Musicology,Medium,"Your music business, musicology and technology focus puts production-curious students at the centre — a modern-production workshop gives them a working framework immediately.",Full-day workshop,medium,Route via MSU Music Business, Musicology & Technology dept.,INSTANTLY_OK,low
Zimbabwe+Namibia,Harare,,Zimbabwe,St George's College Harare,international_school,,info@stgeorges.co.zw,@stgeorgeszimbabwe,+263 242 707961,https://www.stgeorges.co.zw,Multi-instrumental masterclass,High,"Your Jesuit school's strong arts and music tradition makes St George's a natural Harare stop for a multi-instrumental masterclass.",Full-day workshop,medium,Route via info@stgeorges.co.zw to Music Dept. IG @stgeorgeszimbabwe.,INSTANTLY_OK,medium
Zimbabwe+Namibia,Marondera,Mashonaland East,Zimbabwe,Peterhouse Group of Schools,international_school,,registrar@peterhouse.co.zw,@peterhousegroup,+263 279 24951,https://peterhousegroup.co.zw,Multi-instrumental residency + Vocal Harmony,High,"Peterhouse's chapel-choir tradition and strong music programme make it well suited to a visiting-artist residency with a vocal-harmony module.",Week-long residency,medium,"PO Box P, Marondera. Route via registrar to Director of Music. FB @peterhousegroupzimbabwe.",INSTANTLY_OK,medium
Zimbabwe+Namibia,Harare,,Zimbabwe,Prince Edward School,international_school,,info@princeedward.ac.zw,@princeedwardschool,+263 242 706041,https://www.princeedward.ac.zw,Multi-instrumental masterclass,Medium,"As a historic Harare boys' school with an active music programme, a multi-instrumental masterclass would fit your students well.",Half-day intensive,low,Route via school office to Music Dept.,INSTANTLY_OK,low
Zimbabwe+Namibia,Marondera,Mashonaland East,Zimbabwe,Watershed College,international_school,,info@watershedcollege.co.zw,@watershedcollege,+263 65 2382550,https://www.watershedcollege.co.zw,Multi-instrumental masterclass,Medium,"Your active music programme would benefit from a visiting multi-instrumentalist's masterclass for your students.",Half-day intensive,low,Route via school office.,INSTANTLY_OK,low
Zimbabwe+Namibia,Harare,,Zimbabwe,Innovate Institute,international_school,,info@innovateinstitute.co.zw,@innovateinstitute,,https://www.innovateinstitute.co.zw,Modern Music Production + Multi-instrumental,Medium,"As a Glen Forest boarding school built around academic, sporting and artistic excellence, a production and multi-instrumental workshop could anchor a strong arts event.",Half-day intensive,low,Glen Forest, ~20km from Harare CBD. Verify email via site.,INSTANTLY_OK,low
Zimbabwe+Namibia,Windhoek,,Namibia,College of the Arts (COTA) Windhoek,conservatory,COTA Office,info@cota.edu.na,@cotanam,+264 61 374100,https://cota.edu.na,Multi-instrumental masterclass + Jazz Improvisation,Highest,"Since 1971 COTA has taught everything from jazz and popular styles to African instruments (marimba, mbira) — an Indian multi-instrumentalist's cross-tradition masterclass would be a genuinely new addition for Namibia's only dedicated arts college.",Week-long residency,high,"41 Fidel Castro Street, Windhoek; +264 61 374100. FB @cotanam. State arts college since 1971.",INSTANTLY_OK,high
Zimbabwe+Namibia,Windhoek,,Namibia,University of Namibia (UNAM) — Visual & Performing Arts,conservatory,Dept of Visual & Performing Arts,info@unam.na,@unam_namibia,+264 61 206 3111,https://www.unam.edu.na,Music Theory & Ear Training (Indian-influenced),High,"As the only tertiary institution teaching music in Namibia, your Visual & Performing Arts students would gain a genuinely new cross-tradition perspective from an Indian multi-instrumentalist.",Full-day workshop,high,"info@unam.na / +264 61 206 3111. 340 Mandume Ndemufayo Ave, Pionierspark, Windhoek.",INSTANTLY_OK,high
Zimbabwe+Namibia,Windhoek,,Namibia,UNAM Choir,school_choir_social,UNAM Dept of Music,info@unam.na,@unam_namibia,+264 61 206 3111,https://www.unam.edu.na,Vocal Harmony + arrangement,High,"HAND-WRITE. Your renowned university choir would be a wonderful place to share a vocal-harmony and arrangement session — I'd love to discuss a visit personally via the UNAM music department.",Full-day workshop,medium,Hand-write via UNAM Dept of Visual & Performing Arts.,DO_NOT_USE_INSTANTLY,medium
Zimbabwe+Namibia,Windhoek,,Namibia,Windhoek International School,international_school,,info@wis.edu.na,@windhoekinternationalschool,+264 61 241783,https://www.wis.edu.na,Multi-instrumental masterclass,Medium,"Your international community and music programme make WIS a natural Windhoek stop for a visiting multi-instrumentalist's masterclass.",Half-day intensive,low,Route via info@wis.edu.na to Music Dept.,INSTANTLY_OK,low
Zimbabwe+Namibia,Harare,,Zimbabwe,Archdiocese of Harare — Cathedral choirs,church_choir,Archdiocese Music Office,info@catholicharare.org,,,https://www.catholicharare.org,Sacred music arrangement workshop,Medium,"HAND-WRITE. Harare's Catholic community sustains active cathedral choirs — a sacred-music arrangement and vocal-harmony session would be a meaningful contribution. Reach via the Archdiocese music office.",Half-day intensive,low,Hand-write via Archdiocese of Harare music office; verify email.,DO_NOT_USE_INSTANTLY,low
Zimbabwe+Namibia,Harare,,Zimbabwe,St John's College Harare,international_school,,info@stjohns.co.zw,@stjohnsharare,+263 242 870229,https://www.stjohns.co.zw,Multi-instrumental masterclass,Medium,"Your established music programme makes St John's a good Harare stop for a multi-instrumental masterclass for your students.",Half-day intensive,low,Route via school office to Music Dept.,INSTANTLY_OK,low
